{"area_id":"context-and-knowledge","decision_boundary":"Akkor válaszd, ha a kérdés a kontextuskeretről, memóriáról vagy visszakeresésről szól.","format_version":1,"modules":[{"aliases":["memory versus retrieval","memória vagy keresés"],"confidence":"high","id":"decision-guide.memory-vs-retrieval","kind":"decision-guide","maturity":"validated","tags":["knowledge","memory","retrieval"],"title":"Memória vagy visszakeresés"},{"aliases":["context budget allocation","kontextuskeret elosztása"],"confidence":"high","id":"pattern.context-budget-allocation","kind":"pattern","maturity":"validated","tags":["context-engineering","routing","token-budget"],"title":"Kontextuskeret elosztása"},{"aliases":["context compression","kontextustömörítés"],"confidence":"high","id":"pattern.context-compression","kind":"pattern","maturity":"validated","tags":["compression","context-engineering","state"],"title":"Kontextustömörítés döntési állapottal"},{"aliases":["finite context","véges kontextus"],"confidence":"high","id":"principle.context-is-finite","kind":"principle","maturity":"validated","tags":["context","relevance","token-budget"],"title":"A kontextus véges erőforrás"},{"aliases":["felhasználói memória kezelése","user memory lifecycle"],"confidence":"high","id":"procedure.user-memory-lifecycle","kind":"procedure","maturity":"validated","tags":["consent","lifecycle","memory"],"title":"Felhasználói memória életciklusa"}],"scope":"l1","summary":"A releváns információ kiválasztása, megőrzése és tömörítése.","title":"Kontextus és tudás"}
