{"area_id":"continual-evolution","decision_boundary":"Akkor válaszd, ha valódi futások tanulságából kell visszafordítható és validált képességjavítást készíteni.","format_version":1,"modules":[{"aliases":["önfejlődés biztonsági határ"],"id":"checklist.continual-evolution-safety","maturity":"reviewed","tags":["evolution","governance","safety"],"title":"Folyamatos fejlődés biztonsági kapuja"},{"aliases":["kész nem jelent fejlődést"],"id":"checklist.verifiable-improvement-boundary","maturity":"reviewed","tags":["improvement","metrics","verification"],"title":"Ellenőrizhető fejlődés határa"},{"aliases":["tanulási jelet az operatív trajektóriákból"],"id":"concept.operational-trajectory-learning-signal","maturity":"reviewed","tags":["learning","operations","trajectory"],"title":"Operatív trajektória mint tanulási jel"},{"aliases":["tudásba instrukcióba vagy programba kódoljam a tapasztalatot"],"id":"decision-guide.experience-encoding-layer","maturity":"reviewed","tags":["adaptation","experience","knowledge"],"title":"Tapasztalat kódolási rétegének kiválasztása"},{"aliases":["folyamatos agent fejlődési hurok"],"id":"pattern.continual-evolution-closed-loop","maturity":"reviewed","tags":["continual-evolution","feedback","release"],"title":"Folyamatos fejlődés zárt hurka"},{"aliases":["alvási tanulási ciklus"],"id":"pattern.offline-consolidation-cycle","maturity":"reviewed","tags":["consolidation","forgetting","offline"],"title":"Offline konszolidációs ciklus"},{"aliases":["fejlődés módszerének fejlesztése"],"id":"principle.meta-evolution","maturity":"reviewed","tags":["evolution","meta-learning","process"],"title":"A fejlesztési módszer fejlesztése"},{"aliases":["validáljam adjam ki és görgessem vissza az agent fejlődését"],"id":"procedure.evolution-validation-release-rollback","maturity":"reviewed","tags":["release","rollback","validation"],"title":"Fejlődési jelölt validálása, kiadása és visszagörgetése"},{"aliases":["hibából javítási jelölt"],"id":"procedure.failure-diagnosis-to-improvement","maturity":"reviewed","tags":["diagnosis","hypothesis","improvement"],"title":"Hibadiagnózistól javítási jelöltig"},{"aliases":["tapasztalat instrukcióvá"],"id":"procedure.instruction-evolution","maturity":"reviewed","tags":["evaluation","evolution","instructions"],"title":"Instrukció kontrollált fejlesztése"},{"aliases":["tapasztalatból tudás"],"id":"procedure.knowledge-consolidation-from-experience","maturity":"reviewed","tags":["consolidation","experience","knowledge"],"title":"Tapasztalat konszolidálása tudássá"},{"aliases":["tapasztalat súlyfrissítésbe"],"id":"procedure.parameter-update-from-experience","maturity":"reviewed","tags":["experience","parameters","training"],"title":"Paraméterfrissítés tapasztalatból"},{"aliases":["tapasztalat programba"],"id":"procedure.programmatic-skill-evolution","maturity":"reviewed","tags":["evolution","program","skill"],"title":"Programozott képességfejlesztés"}],"scope":"l1","summary":"Operatív tapasztalat ellenőrzött emelése tudásba, instrukcióba, programba vagy paraméterbe.","title":"Folyamatos agentfejlődés"}
