{"area_id":"model-post-training","decision_boundary":"Akkor válaszd, ha a modell paramétereinek tartós módosításáról, tanítási jeléről vagy tréningkörnyezetéről van szó.","format_version":1,"modules":[{"aliases":["utótanítási készenlét"],"id":"checklist.post-training-readiness","maturity":"reviewed","tags":["governance","post-training","readiness"],"title":"Utótanítási készenléti kapu"},{"aliases":["tanítóadat minőségi kapu"],"id":"checklist.training-data-quality","maturity":"reviewed","tags":["governance","quality","training-data"],"title":"Tanítási adatminőség ellenőrzése"},{"aliases":["agent környezet tanulási ciklus"],"id":"concept.agent-environment-learning-loop","maturity":"reviewed","tags":["agent","environment","trajectory"],"title":"Agent–környezet tanulási hurok"},{"aliases":["kredit hozzárendelés több lépéshez"],"id":"concept.multi-turn-credit-assignment","maturity":"reviewed","tags":["credit","multi-turn","reward"],"title":"Többlépéses kredit-hozzárendelés"},{"aliases":["emberi preferenciapárok"],"id":"concept.preference-modeling","maturity":"reviewed","tags":["preference","ranking","reward"],"title":"Preferenciamodellezés"},{"aliases":["előtanítás felügyelt tanítás megerősítés"],"id":"concept.three-stage-model-development","maturity":"reviewed","tags":["pretraining","rl","sft"],"title":"Háromlépcsős modellfejlesztés"},{"aliases":["változó hosszúságú cselekvés"],"id":"concept.variable-length-agent-policy","maturity":"reviewed","tags":["actions","language-model","policy"],"title":"Változó hosszúságú agent politika"},{"aliases":["utótanítási módszerválasztás"],"id":"decision-guide.post-training-method-selection","maturity":"reviewed","tags":["evidence","post-training","selection"],"title":"Utótanítási módszer kiválasztása"},{"aliases":["folyamatjutalmat vagy eredményjutalmat"],"id":"decision-guide.process-or-outcome-reward","maturity":"reviewed","tags":["multi-turn","outcome-reward","process-reward"],"title":"Folyamatjutalom vagy eredményjutalom"},{"aliases":["sűrű vagy ritka jutalomjel"],"id":"decision-guide.reward-signal-density","maturity":"reviewed","tags":["density","learning","reward"],"title":"Jutalomjel sűrűségének kiválasztása"},{"aliases":["rl algoritmusválasztás"],"id":"decision-guide.rl-algorithm-selection","maturity":"reviewed","tags":["algorithm","rl","stability"],"title":"RL algoritmus kiválasztása"},{"aliases":["sft-t rl előtt"],"id":"decision-guide.sft-before-rl","maturity":"reviewed","tags":["rl","sequencing","sft"],"title":"SFT az RL előtt"},{"aliases":["modell mint környezetszimulátor"],"id":"pattern.model-simulated-environment","maturity":"reviewed","tags":["environment","simulation","verification"],"title":"Modell által szimulált környezet"},{"aliases":["on policy desztilláció"],"id":"pattern.on-policy-distillation","maturity":"reviewed","tags":["distillation","efficiency","on-policy"],"title":"Saját eloszlású tanár-desztilláció"},{"aliases":["on policy öndesztilláció"],"id":"pattern.on-policy-self-distillation","maturity":"reviewed","tags":["filtering","on-policy","self-distillation"],"title":"Saját eloszlású öndesztilláció"},{"aliases":["eredményt jutalmazd folyamatot korlátozd"],"id":"pattern.outcome-reward-process-constraints","maturity":"reviewed","tags":["constraints","reward","safety"],"title":"Eredményjutalom folyamatkorlátokkal"},{"aliases":["sft viselkedésutánzás"],"id":"principle.sft-behavior-imitation","maturity":"reviewed","tags":["behavior","demonstrations","sft"],"title":"Az SFT viselkedésmintát tanít"},{"aliases":["tanítási környezet és adat elsőbbsége"],"id":"principle.training-environment-data-priority","maturity":"reviewed","tags":["data","environment","training"],"title":"Környezet és adat az algoritmus előtt"},{"aliases":["sft adatfolyamat"],"id":"procedure.sft-data-pipeline","maturity":"reviewed","tags":["dataset","sft","validation"],"title":"SFT adatfolyamat kialakítása"},{"aliases":["megerősítéses tanulással a tool callingot"],"id":"procedure.tool-call-reinforcement-learning","maturity":"reviewed","tags":["execution","rl","tool-calling"],"title":"Eszközhívás megerősítéses tanítása"}],"scope":"l1","summary":"Súlyszintű viselkedésfejlesztés demonstrációval, jutalommal, környezettel és ellenőrzött tanítási adattal.","title":"Modell-utótanítás"}
