{"area_id":"evaluation-and-improvement","decision_boundary":"Akkor válaszd, ha változtatás hatását vagy fejlesztési módszert kell kiválasztani.","format_version":1,"modules":[{"aliases":["felügyelt vagy megerősítéses tanítás","sft or rl"],"confidence":"medium","id":"decision-guide.sft-or-rl","kind":"decision-guide","maturity":"reviewed","tags":["post-training","rl","sft"],"title":"Felügyelt tanítás vagy megerősítéses optimalizálás"},{"aliases":["experience driven improvement","tapasztalat alapú fejlesztés"],"confidence":"high","id":"pattern.experience-driven-improvement","kind":"pattern","maturity":"validated","tags":["feedback","improvement","learning"],"title":"Tapasztalatból vezérelt fejlesztés"},{"aliases":["agent evaluation loop","agent értékelés"],"confidence":"high","id":"procedure.agent-evaluation-loop","kind":"procedure","maturity":"validated","tags":["evaluation","metrics","regression"],"title":"Agent értékelési ciklus"}],"scope":"l1","summary":"Mérhető agent minőség, visszajelzési ciklus és képességfejlesztési döntés.","title":"Értékelés és fejlesztés"}
