{"area_id":"interaction-and-collaboration","decision_boundary":"Akkor válaszd, ha több csatorna, felületi művelet vagy több agent közötti határ a kérdés.","format_version":1,"modules":[{"aliases":["közös állapot zárolás","shared state concurrency control"],"confidence":"high","id":"checklist.shared-state-concurrency-control","kind":"checklist","maturity":"reviewed","tags":["concurrency","coordination","multi-agent","state"],"title":"Közös állapot konkurenciakezelési ellenőrzőlista"},{"aliases":["multimodal interaction boundary","multimodális határ"],"confidence":"medium","id":"concept.multimodal-interaction-boundary","kind":"concept","maturity":"reviewed","tags":["gui","multimodal","voice"],"title":"Multimodális interakciós határ"},{"aliases":["multi agent topology selection","több agent topológia"],"confidence":"high","id":"decision-guide.multi-agent-topology-selection","kind":"decision-guide","maturity":"reviewed","tags":["collaboration","delegation","multi-agent","topology"],"title":"Több-agent topológia választása"},{"aliases":["hangarchitektúra választás","voice architecture selection"],"confidence":"high","id":"decision-guide.voice-architecture-selection","kind":"decision-guide","maturity":"reviewed","tags":["interaction","multimodal","realtime","voice"],"title":"Hanginterakciós architektúra választása"},{"aliases":["multi agent error amplification","több agent hibasokszorozás"],"confidence":"high","id":"failure-mode.multi-agent-error-amplification","kind":"failure-mode","maturity":"reviewed","tags":["coordination","failure-mode","multi-agent","propagation"],"title":"Több-agent hibaamplifikáció"},{"aliases":["ellenőrzés nélküli végrehajtás","unvalidated autonomy"],"confidence":"high","id":"failure-mode.unvalidated-autonomy","kind":"failure-mode","maturity":"validated","tags":["autonomy","safety","verification"],"title":"Ellenőrizetlen önállóság"},{"aliases":["fast slow interaction loop","gyors lassú interakció"],"confidence":"high","id":"pattern.fast-slow-interaction-loop","kind":"pattern","maturity":"reviewed","tags":["interaction","latency","realtime","voice"],"title":"Gyors–lassú interakciós hurok"},{"aliases":["multi agent context boundaries","több agent határai"],"confidence":"medium","id":"pattern.multi-agent-context-boundaries","kind":"pattern","maturity":"reviewed","tags":["collaboration","context","multi-agent"],"title":"Több-agent kontextushatárok"},{"aliases":["planning control separation","tervezés vezérlés határ"],"confidence":"high","id":"principle.planning-control-separation","kind":"principle","maturity":"reviewed","tags":["control","gui","planning","robotics","safety"],"title":"Tervezés és vezérlés szétválasztása"},{"aliases":["gui action grounding","képernyőművelet megalapozás"],"confidence":"high","id":"procedure.gui-action-grounding","kind":"procedure","maturity":"reviewed","tags":["action","computer-use","gui","perception"],"title":"GUI-művelet megalapozása"},{"aliases":["agent handoff contract","agent átadási szerződés"],"confidence":"high","id":"procedure.multi-agent-handoff-contract","kind":"procedure","maturity":"reviewed","tags":["collaboration","contract","handoff","multi-agent"],"title":"Több-agent átadási szerződés"}],"scope":"l1","summary":"Bizonytalan érzékelés, valós idejű interakció, több-agent átadás és közös állapot kontrollja.","title":"Interakció és együttműködés"}
