{"area_id":"tool-execution","decision_boundary":"Akkor válaszd, ha az agent külső műveletet vagy adatlekérést tervez.","format_version":1,"modules":[{"aliases":["eszközbiztonsági határ","tool safety boundary"],"confidence":"high","id":"checklist.tool-safety-boundary","kind":"checklist","maturity":"validated","tags":["authorization","safety","tools"],"title":"Eszközbiztonsági határlista"},{"aliases":["eszközfelfedezés","tool discovery"],"confidence":"medium","id":"pattern.tool-discovery","kind":"pattern","maturity":"reviewed","tags":["capability","discovery","tools"],"title":"Eszközfelfedezés feladathoz kötve"},{"aliases":["eszközszerződés","tool contract design"],"confidence":"high","id":"procedure.tool-contract-design","kind":"procedure","maturity":"validated","tags":["contracts","tools","validation"],"title":"Eszközszerződés tervezése"}],"scope":"l1","summary":"Eszközszerződés, biztonsági korlát és feladathoz kötött képességválasztás.","title":"Eszközhasználat"}
