{"area_id":"coding-agents","decision_boundary":"Repository-, kódgenerálási vagy fejlesztési feladathoz válaszd.","format_version":1,"modules":[{"aliases":["biztonságos coding agent"],"id":"checklist.coding-agent-security","maturity":"reviewed","tags":["coding-agent","dependencies","sandbox","security"],"title":"Coding-agent biztonsági ellenőrzőlista"},{"aliases":["coding agent harness"],"id":"checklist.coding-harness-design","maturity":"reviewed","tags":["coding-agent","harness","tools","verification"],"title":"Coding harness ellenőrzőlista"},{"aliases":["rendszeradapter kóddal"],"id":"pattern.code-system-adapter","maturity":"reviewed","tags":["adapter","code","contracts","integration"],"title":"Kód mint rendszeradapter"},{"aliases":["üzleti szabály kódban"],"id":"pattern.executable-business-rules","maturity":"reviewed","tags":["business-rules","code","policy","validation"],"title":"Végrehajtható üzleti szabályok"},{"aliases":["generált UI kóddal"],"id":"pattern.generative-ui","maturity":"reviewed","tags":["code","generation","interaction","ui"],"title":"Generatív felhasználói felület"},{"aliases":["session nélküli coding agentet"],"id":"pattern.sessionless-coding-agent","maturity":"reviewed","tags":["coding-agent","repository","sessionless","state"],"title":"Session nélküli coding agent"},{"aliases":["agent saját eszközt készít"],"id":"principle.agent-tool-bootstrapping","maturity":"reviewed","tags":["agent","bootstrapping","code","tools"],"title":"Agent eszköz-önépítés"},{"aliases":["kód mint új eszköz"],"id":"principle.code-as-meta-capability","maturity":"reviewed","tags":["automation","code","coding-agent","tools"],"title":"A kód mint metaképesség"},{"aliases":["kóddal végzett gondolkodás"],"id":"principle.code-as-reasoning-medium","maturity":"reviewed","tags":["code","computation","reasoning","verification"],"title":"A kód mint gondolkodási közeg"},{"aliases":["média generálása kóddal"],"id":"procedure.code-driven-media-generation","maturity":"reviewed","tags":["code","generation","media","reproducibility"],"title":"Kódvezérelt médiagenerálás"},{"aliases":["kódbázis keresés agenttel"],"id":"procedure.coding-agent-search","maturity":"reviewed","tags":["codebase","coding-agent","evidence","search"],"title":"Coding-agent keresési eljárás"},{"aliases":["coding agent workflow"],"id":"procedure.coding-agent-workflow","maturity":"reviewed","tags":["coding-agent","repository","tests","workflow"],"title":"Coding-agent munkafolyamat"},{"aliases":["coding agent hibás módosítás után"],"id":"procedure.coding-error-recovery","maturity":"reviewed","tags":["coding-agent","debugging","git","recovery"],"title":"Coding-agent hibavisszaállítás"},{"aliases":["biztonságosan fájlokat coding agent"],"id":"procedure.safe-file-editing","maturity":"reviewed","tags":["coding-agent","editing","patch","scope"],"title":"Biztonságos fájlszerkesztés"}],"scope":"l1","summary":"Kódalapú gondolkodás, szerkesztés, futtatás és új eszközök létrehozása.","title":"Coding agentek"}
