{"area_id":"multi-agent-coordination","decision_boundary":"Akkor válaszd, ha több önálló agent munkáját, átadását, közös állapotát vagy kölcsönhatását kell kontrollálni.","format_version":1,"modules":[{"aliases":["agent gazdasági verseny kontroll"],"id":"checklist.agent-economy-governance","maturity":"reviewed","tags":["economy","governance","transactions"],"title":"Agentgazdaság governance"},{"aliases":["hibák kaszkádos felerősödését agentek között"],"id":"checklist.cascade-containment","maturity":"reviewed","tags":["cascade","containment","verification"],"title":"Agenthiba-kaszkád megfékezése"},{"aliases":["multi agent hibamód audit"],"id":"checklist.multi-agent-failure-review","maturity":"reviewed","tags":["failure","multi-agent","review"],"title":"Multi-agent hibafelülvizsgálat"},{"aliases":["agent society szimuláció"],"id":"concept.agent-society-simulation","maturity":"reviewed","tags":["emergence","simulation","society"],"title":"Agenttársadalom-szimuláció"},{"aliases":["multi agent osztályozási keret"],"id":"concept.multi-agent-classification-matrix","maturity":"reviewed","tags":["context","multi-agent","topology"],"title":"Multi-agent osztályozási mátrix"},{"aliases":["manager peer decentralizált topológia"],"id":"decision-guide.collaboration-topology","maturity":"reviewed","tags":["coordination","ownership","topology"],"title":"Kollaborációs topológia kiválasztása"},{"aliases":["megosztott vagy izolált kontextust kapjanak az agentek"],"id":"decision-guide.shared-or-isolated-context","maturity":"reviewed","tags":["collaboration","context","isolation"],"title":"Megosztott vagy izolált agentkontextus"},{"aliases":["mikor jobb több agent"],"id":"decision-guide.single-or-multi-agent","maturity":"reviewed","tags":["complexity","multi-agent","single-agent"],"title":"Egy agent vagy több agent"},{"aliases":["fájlrendszer agent kommunikációhoz"],"id":"pattern.filesystem-agent-bus","maturity":"reviewed","tags":["artifacts","coordination","filesystem"],"title":"Fájlrendszer mint agent üzenetbusz"},{"aliases":["külön kontextusú agentek"],"id":"pattern.isolated-context-collaboration","maturity":"reviewed","tags":["artifact","collaboration","isolation"],"title":"Izolált kontextusú együttműködés"},{"aliases":["manager agent több worker agentet"],"id":"pattern.manager-worker-coordination","maturity":"reviewed","tags":["coordination","manager","worker"],"title":"Manager–worker koordináció"},{"aliases":["agentek kölcsönös ellenőrzése"],"id":"pattern.peer-review-collaboration","maturity":"reviewed","tags":["independence","iteration","peer-review"],"title":"Peer review agentkollaboráció"},{"aliases":["decentralizált peer handoff"],"id":"pattern.peer-to-peer-handoff","maturity":"reviewed","tags":["decentralization","handoff","peer-to-peer"],"title":"Peer-to-peer agentátadás"},{"aliases":["közös kontextusú szerepváltás"],"id":"pattern.shared-context-role-switching","maturity":"reviewed","tags":["roles","shared-context","state"],"title":"Szerepváltás közös kontextusban"},{"aliases":["rejtett információs agent játék"],"id":"pattern.strategic-information-asymmetry-simulation","maturity":"reviewed","tags":["information","simulation","strategy"],"title":"Stratégiai információaszimmetria-szimuláció"},{"aliases":["agentek közti kommunikáció vezérlés"],"id":"procedure.agent-communication-control","maturity":"reviewed","tags":["communication","control","protocol"],"title":"Agentkommunikáció és vezérlés"},{"aliases":["szervezetközi agent kommunikáció"],"id":"procedure.cross-boundary-agent-protocol","maturity":"reviewed","tags":["identity","protocol","trust"],"title":"Szervezeti határon átívelő agentprotokoll"},{"aliases":["szakterületek közti agent átadás"],"id":"procedure.cross-domain-role-switch","maturity":"reviewed","tags":["domain","roles","translation"],"title":"Szakterületek közötti szerepváltás"},{"aliases":["többlépcsős agent szerepváltás"],"id":"procedure.multi-stage-role-switch","maturity":"reviewed","tags":["handoff","roles","stages"],"title":"Többlépcsős szerepváltás"},{"aliases":["agentek közös fájljainak ütközése"],"id":"procedure.shared-workspace-concurrency","maturity":"reviewed","tags":["concurrency","ownership","workspace"],"title":"Közös munkatér konkurenciakezelése"}],"scope":"l1","summary":"Több agent kontextus-, topológia-, kommunikáció-, tulajdon- és hibaterjedési szerződései.","title":"Multi-agent koordináció"}
