{"area_id":"core-agent-systems","decision_boundary":"Akkor válaszd, ha a feladat modell, kontextus, eszköz és orchestration együttműködéséről szól.","format_version":1,"modules":[{"aliases":["agent feladatszerződés","feladatindítási szerződés"],"id":"checklist.agent-task-contract","maturity":"reviewed","tags":["agent","contract","scope","task"],"title":"Agent feladatszerződés ellenőrzőlista"},{"aliases":["harness ellenőrzőlista"],"id":"checklist.harness-function-coverage","maturity":"reviewed","tags":["harness","orchestration","safety","state"],"title":"Futtatási keret funkciólefedettsége"},{"aliases":["megfigyelés és akció tér"],"id":"concept.observation-action-interface","maturity":"reviewed","tags":["action","agent","interface","observation"],"title":"Megfigyelési és cselekvési felület"},{"aliases":["modellválasztás agenthez"],"id":"decision-guide.agent-model-selection","maturity":"reviewed","tags":["agent","cost","latency","model-selection","tools"],"title":"Agent modellválasztás"},{"aliases":["determinisztikus vagy autonóm","workflow vagy autonómia"],"id":"decision-guide.workflow-or-autonomy","maturity":"reviewed","tags":["autonomy","orchestration","workflow"],"title":"Workflow vagy autonóm döntés"},{"aliases":["csak modell tervezés","modellközpontú rendszerhiba"],"id":"failure-mode.model-only-system-design","maturity":"reviewed","tags":["agent","architecture","failure-mode","model"],"title":"Csak modellre épített rendszerhiba"},{"aliases":["agent status bar","futási állapotsáv"],"id":"pattern.agent-status-representation","maturity":"reviewed","tags":["agent","context","progress","state"],"title":"Agent futási állapot megjelenítése"},{"aliases":["megfigyelés cselekvés ciklus","observe act loop"],"id":"pattern.react-observe-act-loop","maturity":"reviewed","tags":["action","agent","loop","observation"],"title":"Megfigyelés–döntés–cselekvés ciklus"},{"aliases":["agent operating model","ügynök működési modell"],"id":"principle.agent-operating-model","maturity":"validated","tags":["agent","context","tools"],"title":"Agent működési modell"},{"aliases":["agent keretrendszer","harness engineering"],"id":"principle.harness-engineering","maturity":"reviewed","tags":["agent","harness","orchestration"],"title":"Agent keretrendszer-tervezés"},{"aliases":["guardrail tervezés"],"id":"procedure.guardrail-design","maturity":"reviewed","tags":["guardrail","policy","safety","tools"],"title":"Védőkorlát tervezése"},{"aliases":["emberi jóváhagyási pont"],"id":"procedure.human-escalation-design","maturity":"reviewed","tags":["approval","escalation","human-in-the-loop","safety"],"title":"Emberi eszkaláció tervezése"}],"scope":"l1","summary":"Az agent felépítése, futtatási kerete, állapotkezelése és döntési módja.","title":"Agent alaprendszerek"}
