{"area_id":"real-time-multimodal","decision_boundary":"Akkor válaszd, ha időben folytonos hang-, képernyő- vagy fizikai megfigyelést és cselekvést kell tervezni.","format_version":1,"modules":[{"aliases":["emberibb beszédszintézis"],"id":"checklist.expressive-speech-synthesis","maturity":"reviewed","tags":["safety","speech","synthesis"],"title":"Kifejező beszédszintézis ellenőrzése"},{"aliases":["mobil agent ökoszisztémahatár"],"id":"checklist.mobile-automation-boundary","maturity":"reviewed","tags":["ecosystem","mobile","permissions"],"title":"Mobil automatizálási ökoszisztémahatár"},{"aliases":["gyors lassú állapotátadás"],"id":"concept.fast-slow-state-interface","maturity":"reviewed","tags":["interface","realtime","state"],"title":"Gyors–lassú ág állapotinterfésze"},{"aliases":["gui megfigyelés cselekvés"],"id":"concept.gui-agent-observation-loop","maturity":"reviewed","tags":["action","gui","observation"],"title":"GUI agent megfigyelési hurka"},{"aliases":["gui agent action space-ét"],"id":"decision-guide.gui-action-space","maturity":"reviewed","tags":["action-space","gui","safety"],"title":"GUI agent action space tervezése"},{"aliases":["gondolkodás kifejezés szétválasztása"],"id":"decision-guide.reasoning-expression-coupling","maturity":"reviewed","tags":["expression","latency","reasoning"],"title":"Gondolkodás és kifejezés összekapcsolása"},{"aliases":["voice pipeline architektúrát"],"id":"decision-guide.voice-pipeline-architecture","maturity":"reviewed","tags":["architecture","pipeline","voice"],"title":"Voice pipeline architektúra kiválasztása"},{"aliases":["robot tervezés vezérlés két réteg"],"id":"pattern.embodied-planning-control-stack","maturity":"reviewed","tags":["control","planning","robotics"],"title":"Testet öltött tervezési és vezérlési stack"},{"aliases":["omnimodális voice modell"],"id":"pattern.end-to-end-omnimodal-interaction","maturity":"reviewed","tags":["end-to-end","omnimodal","voice"],"title":"End-to-end omnimodális interakció"},{"aliases":["gyors töltelék lassú válasz"],"id":"pattern.filler-answer-split","maturity":"reviewed","tags":["filler","latency","voice"],"title":"Töltelékjel és válasz szétválasztása"},{"aliases":["full duplex beszélgetés megszakítását"],"id":"pattern.full-duplex-conversation","maturity":"reviewed","tags":["full-duplex","interruption","realtime"],"title":"Full-duplex beszélgetés"},{"aliases":["gyors interakció lassú tanács"],"id":"pattern.interaction-advice-split","maturity":"reviewed","tags":["advice","dual-process","interaction"],"title":"Interakciós és tanácsadó ág szétválasztása"},{"aliases":["streamelt kaszkádolt hang"],"id":"pattern.streaming-cascaded-voice","maturity":"reviewed","tags":["latency","streaming","voice"],"title":"Végponttól végpontig streamelt hanglánc"},{"aliases":["hangalapú ember gép kapcsolat"],"id":"principle.voice-interaction-bandwidth","maturity":"reviewed","tags":["interaction","realtime","voice"],"title":"A hang valós idejű kapcsolati csatorna"},{"aliases":["animációt és hangot érzékelő gui"],"id":"procedure.multisensory-gui-grounding","maturity":"reviewed","tags":["audio","gui","temporal"],"title":"Többérzékű GUI-földelés"},{"aliases":["valós idejű latency budget"],"id":"procedure.real-time-latency-budget","maturity":"reviewed","tags":["budget","latency","realtime"],"title":"Valós idejű késleltetés budgetelése"},{"aliases":["sim2real átviteli rés"],"id":"procedure.sim-to-real-transfer","maturity":"reviewed","tags":["robotics","sim-to-real","validation"],"title":"Szimulációból valós rendszerbe átvitel"},{"aliases":["streamelt beszédforduló érzékelés"],"id":"procedure.streaming-turn-detection","maturity":"reviewed","tags":["perception","streaming","turn-taking"],"title":"Streamelt fordulódetektálás"}],"scope":"l1","summary":"Hang-, GUI- és fizikai interakció streaminggel, megszakítással, késleltetési és biztonsági határokkal.","title":"Valós idejű multimodális rendszerek"}
