{"area_id":"context-and-knowledge","decision_boundary":"Kontextus- és tudáskezelési feladathoz válaszd.","format_version":1,"modules":[{"aliases":["tudás frissesség ellenőrzés"],"id":"checklist.knowledge-freshness-governance","maturity":"reviewed","tags":["freshness","governance","knowledge","review"],"title":"Tudásfrissességi governance"},{"aliases":["memória privacy ellenőrzés"],"id":"checklist.memory-privacy-sanitization","maturity":"reviewed","tags":["logs","memory","privacy","retention"],"title":"Memória adatvédelmi tisztítása"},{"aliases":["prompt injection határ","utasítási támadás védelem"],"id":"checklist.prompt-injection-boundary","maturity":"reviewed","tags":["context-engineering","instructions","prompt-injection","security"],"title":"Promptinjekciós határ ellenőrzőlista"},{"aliases":["API üzenetkontextus"],"id":"concept.api-message-context-model","maturity":"reviewed","tags":["api","context","messages","tools"],"title":"Üzenetalapú kontextusmodell"},{"aliases":["kv cache architektúra","prompt cache tervezés"],"id":"concept.context-cache-architecture","maturity":"reviewed","tags":["cache","context-engineering","kv-cache","prompt-cache"],"title":"Kontextus-gyorsítótár architektúra"},{"aliases":["elkülönített kontextus"],"id":"concept.context-isolation-strategy","maturity":"reviewed","tags":["context","isolation","safety","subagents"],"title":"Kontextusizolációs stratégia"},{"aliases":["dense retrieval"],"id":"concept.dense-retrieval","maturity":"reviewed","tags":["embeddings","retrieval","semantic-search","similarity"],"title":"Szemantikus visszakeresés"},{"aliases":["sparse retrieval"],"id":"concept.sparse-retrieval","maturity":"reviewed","tags":["bm25","keywords","lexical-search","retrieval"],"title":"Lexikális visszakeresés"},{"aliases":["strukturált tudásindex","tudásgráf indexelés"],"id":"concept.structured-knowledge-index","maturity":"reviewed","tags":["graph","index","knowledge","metadata"],"title":"Strukturált tudásindex"},{"aliases":["few-shot példaválasztás"],"id":"decision-guide.few-shot-example-selection","maturity":"reviewed","tags":["examples","few-shot","generalization","prompt"],"title":"Kevés példás minta kiválasztása"},{"aliases":["agent memória értékelés"],"id":"decision-guide.memory-capability-evaluation","maturity":"reviewed","tags":["evaluation","memory","personalization","recall"],"title":"Memóriaképesség értékelése"},{"aliases":["memóriaformátum választás"],"id":"decision-guide.memory-representation-selection","maturity":"reviewed","tags":["memory","representation","structured-data"],"title":"Memóriaábrázolás választása"},{"aliases":["memory versus retrieval","memória vagy keresés"],"id":"decision-guide.memory-vs-retrieval","maturity":"validated","tags":["knowledge","memory","retrieval"],"title":"Memória vagy visszakeresés"},{"aliases":["multimodális információszerzés"],"id":"decision-guide.multimodal-information-processing","maturity":"reviewed","tags":["documents","multimodal","retrieval","tools"],"title":"Multimodális tudásfeldolgozási stratégia"},{"aliases":["folyamat vagy szabálylista"],"id":"decision-guide.process-instructions-or-rule-stack","maturity":"reviewed","tags":["orchestration","process","prompt","rules"],"title":"Folyamatutasítás vagy szabályhalmaz"},{"aliases":["hibrid retrieval","hibrid retrievalt visszakereséséhez","retrieval stratégia választás"],"id":"decision-guide.retrieval-strategy-selection","maturity":"reviewed","tags":["hybrid-retrieval","knowledge","retrieval","search"],"title":"Visszakeresési stratégia választása"},{"aliases":["státuszfrissítés helye"],"id":"decision-guide.status-update-placement","maturity":"reviewed","tags":["cache","context","status","updates"],"title":"Státuszfrissítés elhelyezése"},{"aliases":["agentic RAG vezérlés"],"id":"pattern.agentic-retrieval-control","maturity":"reviewed","tags":["agent","retrieval","tools","verification"],"title":"Agent által vezérelt visszakeresés"},{"aliases":["context budget allocation","kontextuskeret elosztása"],"id":"pattern.context-budget-allocation","maturity":"validated","tags":["context-engineering","routing","token-budget"],"title":"Kontextuskeret elosztása"},{"aliases":["context compression","kontextustömörítés"],"id":"pattern.context-compression","maturity":"validated","tags":["compression","context-engineering","state"],"title":"Kontextustömörítés döntési állapottal"},{"aliases":["kontextusos keresés"],"id":"pattern.contextual-retrieval","maturity":"reviewed","tags":["context","documents","ranking","retrieval"],"title":"Kontextuális visszakeresés"},{"aliases":["dinamikus skill betöltés","igény szerinti képességbetöltés"],"id":"pattern.dynamic-skill-loading","maturity":"reviewed","tags":["capability","context-engineering","routing","skills"],"title":"Dinamikus skill-betöltés"},{"aliases":["szerkeszthető agent jegyzet"],"id":"pattern.editable-context-notes","maturity":"reviewed","tags":["cache","context","notes","state"],"title":"Szerkeszthető kontextusjegyzetek"},{"aliases":["mappaalapú tudásrendezés"],"id":"pattern.filesystem-knowledge-organization","maturity":"reviewed","tags":["filesystem","governance","indexes","knowledge"],"title":"Fájlrendszer-alapú tudásszervezés"},{"aliases":["hierarchikus kontextustömörítés","többszintű tömörítés"],"id":"pattern.hierarchical-context-compression","maturity":"reviewed","tags":["compression","context-engineering","hierarchy","state"],"title":"Hierarchikus kontextustömörítés"},{"aliases":["felhasználóhoz memóriaszinteket","memóriaszintek"],"id":"pattern.memory-hierarchy","maturity":"reviewed","tags":["hierarchy","memory","session","user"],"title":"Hierarchikus memória"},{"aliases":["finite context","véges kontextus"],"id":"principle.context-is-finite","maturity":"validated","tags":["context","relevance","token-budget"],"title":"A kontextus véges erőforrás"},{"aliases":["üzleti szabály fordítás"],"id":"procedure.business-rule-compilation","maturity":"reviewed","tags":["business-rules","policy","prompt","validation"],"title":"Üzleti szabályok végrehajtható fordítása"},{"aliases":["stabil cache kontextus"],"id":"procedure.cache-stable-context-layout","maturity":"reviewed","tags":["cache","context","latency","prompt"],"title":"Cache-stabil kontextuselrendezés"},{"aliases":["dokumentum chunkolás"],"id":"procedure.document-chunking-strategy","maturity":"reviewed","tags":["chunking","context","documents","retrieval"],"title":"Dokumentumdarabolási stratégia"},{"aliases":["sűrű és ritka keresés egyesítése"],"id":"procedure.hybrid-retrieval-fusion","maturity":"reviewed","tags":["hybrid","ranking","retrieval"],"title":"Hibrid visszakeresési fúzió"},{"aliases":["emlék konszolidáció"],"id":"procedure.memory-consolidation","maturity":"reviewed","tags":["consolidation","lifecycle","memory","review"],"title":"Memóriakonszolidáció"},{"aliases":["strukturált rendszerprompt"],"id":"procedure.prompt-structure-design","maturity":"reviewed","tags":["context","instructions","prompt","structure"],"title":"Promptstruktúra tervezése"},{"aliases":["retrieval pipeline tervezés","visszakeresési folyamat"],"id":"procedure.retrieval-pipeline-design","maturity":"reviewed","tags":["chunking","knowledge","rag","retrieval"],"title":"Visszakeresési folyamat tervezése"},{"aliases":["agent státuszjel"],"id":"procedure.status-signal-design","maturity":"reviewed","tags":["agent","observability","state","status"],"title":"Agent státuszjel tervezése"},{"aliases":["rendszerprompt architektúra","utasításrétegezés"],"id":"procedure.system-prompt-architecture","maturity":"reviewed","tags":["context-engineering","instructions","policy","system-prompt"],"title":"Rendszerprompt architektúra"},{"aliases":["felhasználói memória kezelése","user memory lifecycle"],"id":"procedure.user-memory-lifecycle","maturity":"validated","tags":["consent","lifecycle","memory"],"title":"Felhasználói memória életciklusa"}],"scope":"l1","summary":"Kontextus, memória és retrieval.","title":"Kontextus és tudás"}
