{"area_id":"interaction-and-collaboration","decision_boundary":"Akkor válaszd, ha több csatorna, felületi művelet vagy több agent közötti határ a kérdés.","format_version":1,"modules":[{"aliases":["közös állapot zárolás","shared state concurrency control"],"id":"checklist.shared-state-concurrency-control","maturity":"reviewed","tags":["concurrency","coordination","multi-agent","state"],"title":"Közös állapot konkurenciakezelési ellenőrzőlista"},{"aliases":["multimodal interaction boundary","multimodális határ"],"id":"concept.multimodal-interaction-boundary","maturity":"reviewed","tags":["gui","multimodal","voice"],"title":"Multimodális interakciós határ"},{"aliases":["multi agent topology selection","több agent topológia"],"id":"decision-guide.multi-agent-topology-selection","maturity":"reviewed","tags":["collaboration","delegation","multi-agent","topology"],"title":"Több-agent topológia választása"},{"aliases":["hangarchitektúra választás","voice architecture selection"],"id":"decision-guide.voice-architecture-selection","maturity":"reviewed","tags":["interaction","multimodal","realtime","voice"],"title":"Hanginterakciós architektúra választása"},{"aliases":["multi agent error amplification","több agent hibasokszorozás"],"id":"failure-mode.multi-agent-error-amplification","maturity":"reviewed","tags":["coordination","failure-mode","multi-agent","propagation"],"title":"Több-agent hibaamplifikáció"},{"aliases":["ellenőrzés nélküli végrehajtás","unvalidated autonomy"],"id":"failure-mode.unvalidated-autonomy","maturity":"validated","tags":["autonomy","safety","verification"],"title":"Ellenőrizetlen önállóság"},{"aliases":["fast slow interaction loop","gyors lassú interakció"],"id":"pattern.fast-slow-interaction-loop","maturity":"reviewed","tags":["interaction","latency","realtime","voice"],"title":"Gyors–lassú interakciós hurok"},{"aliases":["multi agent context boundaries","több agent határai"],"id":"pattern.multi-agent-context-boundaries","maturity":"reviewed","tags":["collaboration","context","multi-agent"],"title":"Több-agent kontextushatárok"},{"aliases":["planning control separation","tervezés vezérlés határ"],"id":"principle.planning-control-separation","maturity":"reviewed","tags":["control","gui","planning","robotics","safety"],"title":"Tervezés és vezérlés szétválasztása"},{"aliases":["gui action grounding","képernyőművelet megalapozás"],"id":"procedure.gui-action-grounding","maturity":"reviewed","tags":["action","computer-use","gui","perception"],"title":"GUI-művelet megalapozása"},{"aliases":["agent handoff contract","agent átadási szerződés"],"id":"procedure.multi-agent-handoff-contract","maturity":"reviewed","tags":["collaboration","contract","handoff","multi-agent"],"title":"Több-agent átadási szerződés"}],"scope":"l1","summary":"Bizonytalan érzékelés, valós idejű interakció, több-agent átadás és közös állapot kontrollja.","title":"Interakció és együttműködés"}
